{
  "esquema": "residuo/v0.1",
  "perfil": "minimizado",
  "evento": {
    "id_evento": "7c8d9e0f-1a2b-4c3d-8e5f-6a7b8c9d0e1f",
    "creado_en": "2026-07-15T18:40:00-03:00",
    "repositorio": "sha256:f1e2d3c4b5a69788f1e2d3c4b5a69788f1e2d3c4b5a69788f1e2d3c4b5a69788",
    "commit_base": "c0ffee1",
    "commit_cabeza": "beef042",
    "compuerta": "diff",
    "nivel_criticidad": "B",
    "ruta_abreviada": {
      "usada": false
    }
  },
  "actores": {
    "generador": {
      "familia": "anthropic",
      "modelo": "claude-code"
    },
    "revisores": [
      {
        "id_revisor": "r1",
        "familia": "openai",
        "modelo": "gpt-5.4",
        "consigna_hash": "sha256:1c2d3e4f5a6b7c8d9e0f1a2b3c4d5e6f7a8b9c0d1e2f3a4b5c6d7e8f9a0b1c2d",
        "confinamiento": {
          "modo": "solo_lectura_por_instruccion",
          "verificado": true,
          "metodo_verificacion": "git_status_limpio"
        }
      }
    ],
    "arbitro_humano": {
      "presente": true
    }
  },
  "hallazgos": [
    {
      "id": "h1",
      "origen": "r1",
      "severidad": "mayor",
      "estado_final": "incorporado",
      "verificacion": { "contra": "repositorio" },
      "verificacion_de_la_correccion": { "tipo": "prueba_especifica" }
    },
    {
      "id": "h2",
      "origen": "r1",
      "severidad": "mayor",
      "estado_final": "escalado_abierto",
      "verificacion": { "contra": "repositorio" }
    },
    {
      "id": "h3",
      "origen": "r1",
      "severidad": "menor",
      "estado_final": "refutado_verificable",
      "verificacion": { "contra": "repositorio" },
      "evidencia": {
        "hash": "sha256:aa11bb22cc33dd44ee55ff667788990011223344556677889900aabbccddeeff"
      }
    }
  ],
  "residuo": {
    "items": [
      {
        "id": "r1",
        "clase": "escalado_sin_decision",
        "ref_hallazgo": "h2",
        "requiere_atencion_humana": true
      },
      {
        "id": "r2",
        "clase": "refutacion_del_principal",
        "ref_hallazgo": "h3",
        "tipo_refutacion": "verificable",
        "requiere_atencion_humana": false,
        "evidencia": {
          "hash": "sha256:aa11bb22cc33dd44ee55ff667788990011223344556677889900aabbccddeeff"
        }
      },
      {
        "id": "r3",
        "clase": "gap_de_ejecucion",
        "requiere_atencion_humana": true,
        "motivo_gap": "entorno_no_reproduce"
      }
    ]
  },
  "metricas": {
    "conteos": {
      "total_hallazgos": 3,
      "validos": {
        "incorporado": 1,
        "deuda_registrada": 0,
        "decision_del_dueno": 0
      },
      "falsos_positivos": {
        "refutado_verificable": 1,
        "refutado_interpretativo": 0
      },
      "escalados_abiertos": 1
    },
    "tiempo_extra_seg": 2400
  }
}
