{
  "esquema": "residuo/v0.1",
  "perfil": "completo",
  "evento": {
    "id_evento": "7c8d9e0f-1a2b-4c3d-8e5f-6a7b8c9d0e1f",
    "creado_en": "2026-07-15T18:40:00-03:00",
    "repositorio": "https://github.com/ejemplo/sistema-interno",
    "pr": "https://github.com/ejemplo/sistema-interno/pull/214",
    "commit_base": "c0ffee1",
    "commit_cabeza": "beef042",
    "compuerta": "diff",
    "nivel_criticidad": "B",
    "ruta_abreviada": {
      "usada": false
    }
  },
  "actores": {
    "generador": {
      "familia": "anthropic",
      "modelo": "claude-code"
    },
    "revisores": [
      {
        "id_revisor": "r1",
        "familia": "openai",
        "modelo": "gpt-5.4",
        "consigna_hash": "sha256:1c2d3e4f5a6b7c8d9e0f1a2b3c4d5e6f7a8b9c0d1e2f3a4b5c6d7e8f9a0b1c2d",
        "confinamiento": {
          "modo": "solo_lectura_por_instruccion",
          "verificado": true,
          "metodo_verificacion": "git_status_limpio"
        }
      }
    ],
    "arbitro_humano": {
      "presente": true,
      "id": "dueno-feature-02"
    }
  },
  "hallazgos": [
    {
      "id": "h1",
      "origen": "r1",
      "severidad": "mayor",
      "titulo": "El flujo de escritura no se libera si la consulta falla a mitad de camino",
      "descripcion": "En la exportacion, una falla intermedia de la consulta dejaba el flujo de escritura tomado.",
      "estado_final": "incorporado",
      "verificacion": { "contra": "repositorio", "detalle": "Confirmado en el codigo del diff: faltaba la liberacion en el camino de error." },
      "verificacion_de_la_correccion": {
        "tipo": "prueba_especifica",
        "referencia": "tests/Exportacion_FallaIntermedia_LiberaFlujo"
      }
    },
    {
      "id": "h2",
      "origen": "r1",
      "severidad": "mayor",
      "titulo": "Limite de filas de la exportacion sin definir",
      "descripcion": "El comportamiento ante rangos que superan el maximo permitido no esta definido por producto.",
      "estado_final": "escalado_abierto",
      "verificacion": { "contra": "repositorio", "detalle": "El codigo no impone limite y el requerimiento no lo especifica: la decision no es tecnica." }
    },
    {
      "id": "h3",
      "origen": "r1",
      "severidad": "menor",
      "titulo": "Validacion de fechas supuestamente faltante",
      "descripcion": "El revisor reporto que la exportacion no valida el rango de fechas de entrada.",
      "estado_final": "refutado_verificable",
      "verificacion": { "contra": "repositorio", "detalle": "La validacion existe en el objeto de consulta compartido que este flujo reutiliza." },
      "evidencia": {
        "texto": "El objeto de consulta compartido valida el rango antes de ejecutar; la exportacion lo reutiliza sin excepcion.",
        "enlace": "src/consultas/RangoFechas.cs#L41-L58"
      }
    }
  ],
  "residuo": {
    "items": [
      {
        "id": "r1",
        "clase": "escalado_sin_decision",
        "ref_hallazgo": "h2",
        "requiere_atencion_humana": true,
        "descripcion": "El limite de filas de la exportacion quedo escalado a producto y sin resolver al cierre del ciclo."
      },
      {
        "id": "r2",
        "clase": "refutacion_del_principal",
        "ref_hallazgo": "h3",
        "tipo_refutacion": "verificable",
        "requiere_atencion_humana": false,
        "descripcion": "Refutacion con enlace al objeto de consulta compartido, para que el revisor humano pueda no darla por buena.",
        "evidencia": {
          "texto": "La validacion vive en el objeto de consulta compartido reutilizado por la exportacion.",
          "enlace": "src/consultas/RangoFechas.cs#L41-L58"
        }
      },
      {
        "id": "r3",
        "clase": "gap_de_ejecucion",
        "requiere_atencion_humana": true,
        "motivo_gap": "entorno_no_reproduce",
        "descripcion": "El comportamiento bajo concurrencia real no se probo porque el entorno de desarrollo no la reproduce."
      }
    ]
  },
  "metricas": {
    "conteos": {
      "total_hallazgos": 3,
      "validos": {
        "incorporado": 1,
        "deuda_registrada": 0,
        "decision_del_dueno": 0
      },
      "falsos_positivos": {
        "refutado_verificable": 1,
        "refutado_interpretativo": 0
      },
      "escalados_abiertos": 1
    },
    "tiempo_extra_seg": 2400
  }
}
