{
  "esquema": "residuo/v0.1",
  "perfil": "completo",
  "evento": {
    "id_evento": "3f2a9c1e-8b4d-4e6a-9c7f-1a2b3c4d5e6f",
    "creado_en": "2026-06-28T22:36:00-03:00",
    "repositorio": "https://github.com/ejemplo/app-gastos-hogar",
    "commit_base": "0000000",
    "commit_cabeza": "a1b2c3d",
    "compuerta": "plan",
    "nivel_criticidad": "B",
    "ruta_abreviada": {
      "usada": false,
      "casos_protegidos_tocados": ["autenticacion_autorizacion", "calculo_economico"]
    }
  },
  "actores": {
    "generador": {
      "familia": "anthropic",
      "modelo": "claude-code"
    },
    "revisores": [
      {
        "id_revisor": "r1",
        "familia": "openai",
        "modelo": "gpt-5.4",
        "id_sesion": "019f105d-5994-7942-98b5-3e775f0e8dff",
        "consigna_hash": "sha256:9b1f4c0a4a1e2d3f4b5a6978877665544332211009f8e7d6c5b4a3928170605f",
        "confinamiento": {
          "modo": "solo_lectura_por_instruccion",
          "verificado": true,
          "metodo_verificacion": "git_status_limpio"
        }
      }
    ],
    "arbitro_humano": {
      "presente": true,
      "id": "dueno-feature-01"
    }
  },
  "hallazgos": [
    {
      "id": "h1",
      "origen": "r1",
      "severidad": "critica",
      "titulo": "El cliente tiene escritura directa: la validacion server-side es opcional",
      "descripcion": "El plan otorgaba INSERT y UPDATE directos al cliente, de modo que podia saltarse el RPC de validacion e insertar registros con el split forjado. El modelo de autoridad no se sostenia.",
      "estado_final": "incorporado",
      "verificacion": { "contra": "repositorio", "detalle": "Confirmado contra la matriz de permisos del plan: el grant DML directo existia." },
      "ajuste_al_remedio": "El remedio literal del revisor (FORCE ROW LEVEL SECURITY) se descarto con contraejemplo: bloquearia la transicion legitima de estado del cierre. Se adopto REVOKE de DML mas escritura exclusiva por RPC con SECURITY DEFINER; la inmutabilidad la garantizan los triggers.",
      "verificacion_de_la_correccion": {
        "tipo": "pendiente_en_compuerta_diff",
        "referencia": "El plan corregido se verifica cuando el SQL escrito pase su propia compuerta de diff."
      }
    },
    {
      "id": "h2",
      "origen": "r1",
      "severidad": "critica",
      "titulo": "Carrera entre cierre de mes y alta de cargo",
      "descripcion": "Sin un lock compartido entre el cierre y el alta, un cargo tardio puede colarse entre la validacion y la liquidacion.",
      "estado_final": "incorporado",
      "verificacion": { "contra": "repositorio", "detalle": "La secuencia del RPC de cierre del plan no tomaba lock; el intercalado era posible." },
      "verificacion_de_la_correccion": {
        "tipo": "pendiente_en_compuerta_diff",
        "referencia": "pg_advisory_xact_lock por unidad y mes, incorporado al plan; se verifica sobre el SQL."
      }
    },
    {
      "id": "h3",
      "origen": "r1",
      "severidad": "critica",
      "titulo": "El bloqueo de mes cerrado cubria INSERT pero no UPDATE",
      "descripcion": "Mover un registro existente hacia un mes cerrado, o cambiarle el estado, esquivaba el trigger que solo miraba inserciones.",
      "estado_final": "incorporado",
      "verificacion": { "contra": "repositorio", "detalle": "La tabla de triggers del plan solo cubria BEFORE INSERT para ese caso." },
      "verificacion_de_la_correccion": {
        "tipo": "pendiente_en_compuerta_diff",
        "referencia": "Trigger extendido a BEFORE UPDATE, incorporado al plan."
      }
    },
    {
      "id": "h4",
      "origen": "r1",
      "severidad": "mayor",
      "titulo": "Anti forja en el alta y errores sin fuga de informacion",
      "descripcion": "Faltaban validaciones de cardinalidad y secuencia de cuotas en el RPC de alta, y los mensajes de error podian filtrar detalle interno.",
      "estado_final": "incorporado",
      "verificacion": { "contra": "repositorio", "detalle": "Las validaciones listadas en el plan no cubrian cardinalidad ni numeracion de cuotas." },
      "verificacion_de_la_correccion": {
        "tipo": "pendiente_en_compuerta_diff",
        "referencia": "Validaciones y errores genericos agregados al plan."
      }
    },
    {
      "id": "h5",
      "origen": "r1",
      "severidad": "menor",
      "titulo": "Propuesta de CHECK(monto distinto de cero)",
      "descripcion": "El revisor propuso un CHECK que prohibe montos en cero en la tabla de cargos.",
      "estado_final": "refutado_verificable",
      "verificacion": { "contra": "repositorio", "detalle": "Contrastado con la regla de generacion de cuotas del dominio." },
      "evidencia": {
        "texto": "La generacion valida de cuotas produce montos en cero: un total de 0.01 en tres cuotas rinde 0.00, 0.00 y 0.01, con la ultima cuota absorbiendo el redondeo. El CHECK rechazaria filas legitimas.",
        "enlace": "plan#regla-redondeo-cuotas"
      }
    },
    {
      "id": "h6",
      "origen": "r1",
      "severidad": "critica",
      "titulo": "La validacion liviana del cierre deja pasar snapshots mal pero consistentes",
      "descripcion": "El snapshot que se congela como inmutable pasaba con verificaciones de suma y balance que no detectan un intercambio de deudas entre miembros ni un split errado por cargo.",
      "estado_final": "decision_del_dueno",
      "verificacion": { "contra": "repositorio", "detalle": "Confirmado: los tres chequeos del plan eran insuficientes para el caso de intercambio." },
      "registro_riesgo": "El dueno adopto recompute and compare en el servidor sobre el conjunto lockeado, con la misma regla por cargo del motor. Cambia el alcance de la entrega. Riesgo aceptado: replicar la regla de redondeo en SQL introduce posibilidad de drift, mitigada con un test de paridad entre el motor y el SQL."
    }
  ],
  "residuo": {
    "items": [
      {
        "id": "r1",
        "clase": "refutacion_del_principal",
        "ref_hallazgo": "h5",
        "tipo_refutacion": "verificable",
        "requiere_atencion_humana": false,
        "descripcion": "El generador refuto el CHECK propuesto por el revisor con contraejemplo del dominio.",
        "evidencia": {
          "texto": "Total 0.01 en tres cuotas rinde 0.00, 0.00 y 0.01: las primeras cuotas pueden ser cero por regla de redondeo.",
          "enlace": "plan#regla-redondeo-cuotas"
        }
      }
    ]
  },
  "metricas": {
    "conteos": {
      "total_hallazgos": 6,
      "validos": {
        "incorporado": 4,
        "deuda_registrada": 0,
        "decision_del_dueno": 1
      },
      "falsos_positivos": {
        "refutado_verificable": 1,
        "refutado_interpretativo": 0
      },
      "escalados_abiertos": 0
    },
    "tiempo_extra_seg": 2700,
    "costo_tokens": {
      "revisores": 41000
    }
  }
}
